{"approvalStatus":"FIXTURE_ONLY","approvedBy":"fixture-only-no-human-acceptance","approvedDecisionRef":"fixture-only-no-product-approval","difficultyBand":"dienstbeginn","generatorVersion":"path-search-v1","gridRanges":{"maxDensityPercent":90,"maxSize":5,"minDensityPercent":10,"minSize":4},"humanReview":{"calibrationVersion":"SYNTHETIC_NO_HUMAN_V1","criteriaVersion":"SYNTHETIC_TEST_NO_HUMAN_EVIDENCE","evidenceSha256":"96a36aebca45af0eebad9cd611af96fc5b9d24d7d53c6c72c4eecebd4bca552e","sampleCount":12,"uiSourceSha256":"fc0c2a3f02fcd00445a5c5a1ab1d1e8017657329c84447b619ff76c77b15a8ee"},"metricRanges":{"deductionSteps":{"max":1000000,"min":0},"maxDeductionDepth":{"max":1000000,"min":0},"requiredGuessDepth":{"max":0,"min":0},"searchNodes":{"max":1000000,"min":0},"trivialLines":{"max":20,"min":0}},"novelty":{"algorithmVersion":"public-d4-l1-v1","recentSimilarityPercent":0,"recentWindow":50,"referenceCorpus":{"catalogId":"fixture-import-public","hashSha256":"1c233f11b09b48f72670a3d96b3f73a39ae9d2036ec6db73f81f66210267df31","revision":1}},"profileId":"dienstbeginn","profileVersion":1,"rulesetVersion":"train-track-v1","runtimeBudgets":{"hintBudgetMs":100,"hintStateBudget":100000,"maxAttempts":10,"pathStateBudget":1000,"solverBudgetMs":100,"solverStateBudget":1000000,"timeoutPolicy":"ABORT_ATTEMPT_KEEP_RESERVATION","totalBudgetMs":1000},"schemaVersion":1,"solverVersion":"solver-v2"}